camel-kit-knowledge/indexer/src/main/resources/rh-build-camel/errata/cves/CVE-2023-24422.json

{
  "threat_severity" : "Important",
  "public_date" : "2023-01-24T00:00:00Z",
  "bugzilla" : {
    "description" : "jenkins-2-plugins/script-security: Sandbox bypass vulnerability in Script Security Plugin",
    "id" : "2164278",
    "url" : "https://bugzilla.redhat.com/show_bug.cgi?id=2164278"
  },
  "cvss3" : {
    "cvss3_base_score" : "8.8",
    "cvss3_scoring_vector" : "CVSS:3.1/AV:N/AC:L/PR:L/UI:N/S:U/C:H/I:H/A:H",
    "status" : "verified"
  },
  "cwe" : "CWE-20",
  "details" : [ "A sandbox bypass vulnerability involving map constructors in Jenkins Script Security Plugin 1228.vd93135a_2fb_25 and earlier allows attackers with permission to define and run sandboxed scripts, including Pipelines, to bypass the sandbox protection and execute arbitrary code in the context of the Jenkins controller JVM.", "A flaw was found in the script-security Jenkins Plugin. In affected versions of the script-security plugin, property assignments performed implicitly by the Groovy language runtime when invoking map constructors were not intercepted by the sandbox. This vulnerability allows attackers with permission to define and run sandboxed scripts, including Pipelines, to bypass the sandbox protection and execute arbitrary code in the context of the Jenkins controller JVM." ],
  "statement" : "OpenShift 3.11 is already in the ELS support model phase. The Jenkins components are out of scope of the ELS support; hence OpenShift 3.11 Jenkins component is marked in this CVE as out of support scope.",
  "affected_release" : [ {
    "product_name" : "OCP-Tools-4.12-RHEL-8",
    "release_date" : "2023-05-18T00:00:00Z",
    "advisory" : "RHSA-2023:3195",
    "cpe" : "cpe:/a:redhat:ocp_tools:4.12::el8",
    "package" : "jenkins-2-plugins-0:4.12.1683009955-1.el8"
  }, {
    "product_name" : "OCP-Tools-4.12-RHEL-8",
    "release_date" : "2023-06-15T00:00:00Z",
    "advisory" : "RHSA-2023:3610",
    "cpe" : "cpe:/a:redhat:ocp_tools:4.12::el8",
    "package" : "jenkins-2-plugins-0:4.12.1686649756-1.el8"
  }, {
    "product_name" : "OCP-Tools-4.12-RHEL-8",
    "release_date" : "2023-10-30T00:00:00Z",
    "advisory" : "RHSA-2023:6172",
    "cpe" : "cpe:/a:redhat:ocp_tools:4.12::el8",
    "package" : "jenkins-2-plugins-0:4.12.1698294000-1.el8"
  }, {
    "product_name" : "OCP-Tools-4.12-RHEL-8",
    "release_date" : "2024-02-12T00:00:00Z",
    "advisory" : "RHSA-2024:0778",
    "cpe" : "cpe:/a:redhat:ocp_tools:4.12::el8",
    "package" : "jenkins-2-plugins-0:4.12.1706515741-1.el8"
  }, {
    "product_name" : "OCP-Tools-4.13-RHEL-8",
    "release_date" : "2023-05-24T00:00:00Z",
    "advisory" : "RHSA-2023:3299",
    "cpe" : "cpe:/a:redhat:ocp_tools:4.13::el8",
    "package" : "jenkins-2-plugins-0:4.13.1684911916-1.el8"
  }, {
    "product_name" : "OCP-Tools-4.13-RHEL-8",
    "release_date" : "2023-10-30T00:00:00Z",
    "advisory" : "RHSA-2023:6179",
    "cpe" : "cpe:/a:redhat:ocp_tools:4.13::el8",
    "package" : "jenkins-2-plugins-0:4.13.1698292274-1.el8"
  }, {
    "product_name" : "OCP-Tools-4.13-RHEL-8",
    "release_date" : "2024-02-12T00:00:00Z",
    "advisory" : "RHSA-2024:0776",
    "cpe" : "cpe:/a:redhat:ocp_tools:4.13::el8",
    "package" : "jenkins-2-plugins-0:4.13.1706516346-1.el8"
  }, {
    "product_name" : "OCP-Tools-4.14-RHEL-8",
    "release_date" : "2023-11-16T00:00:00Z",
    "advisory" : "RHSA-2023:7288",
    "cpe" : "cpe:/a:redhat:ocp_tools:4.14::el8",
    "package" : "jenkins-2-plugins-0:4.14.1699356715-1.el8"
  }, {
    "product_name" : "OCP-Tools-4.14-RHEL-8",
    "release_date" : "2024-02-12T00:00:00Z",
    "advisory" : "RHSA-2024:0777",
    "cpe" : "cpe:/a:redhat:ocp_tools:4.14::el8",
    "package" : "jenkins-2-plugins-0:4.14.1706516441-1.el8"
  }, {
    "product_name" : "OpenShift Developer Tools and Services for OCP 4.11",
    "release_date" : "2023-05-17T00:00:00Z",
    "advisory" : "RHSA-2023:3198",
    "cpe" : "cpe:/a:redhat:ocp_tools:4.11::el8",
    "package" : "jenkins-2-plugins-0:4.11.1683009941-1.el8"
  }, {
    "product_name" : "OpenShift Developer Tools and Services for OCP 4.11",
    "release_date" : "2023-10-30T00:00:00Z",
    "advisory" : "RHSA-2023:6171",
    "cpe" : "cpe:/a:redhat:ocp_tools:4.11::el8",
    "package" : "jenkins-2-plugins-0:4.11.1698299029-1.el8"
  }, {
    "product_name" : "OpenShift Developer Tools and Services for OCP 4.11",
    "release_date" : "2024-02-12T00:00:00Z",
    "advisory" : "RHSA-2024:0775",
    "cpe" : "cpe:/a:redhat:ocp_tools:4.11::el8",
    "package" : "jenkins-2-plugins-0:4.11.1706516946-1.el8"
  }, {
    "product_name" : "Red Hat OpenShift Container Platform 4.10",
    "release_date" : "2023-04-12T00:00:00Z",
    "advisory" : "RHSA-2023:1655",
    "cpe" : "cpe:/a:redhat:openshift:4.10::el8",
    "package" : "jenkins-2-plugins-0:4.10.1680703106-1.el8"
  } ],
  "package_state" : [ {
    "product_name" : "Red Hat OpenShift Container Platform 3.11",
    "fix_state" : "Out of support scope",
    "package_name" : "jenkins-2-plugins",
    "cpe" : "cpe:/a:redhat:openshift:3.11"
  } ],
  "references" : [ "https://www.cve.org/CVERecord?id=CVE-2023-24422\nhttps://nvd.nist.gov/vuln/detail/CVE-2023-24422\nhttps://www.jenkins.io/security/advisory/2023-01-24/#SECURITY-3016" ],
  "name" : "CVE-2023-24422",
  "csaw" : false
}

camel-kit-knowledge/indexer/src/main/resources/rh-build-camel/4.14/release-notes-quarkus.md

#### [1.6.2. Refactored .endChoice() behavior with Java DSL Copy link](#refactored_endchoice_behavior_with_java_dsl)

However, there has been some regressions from upgrading older Camel releases to 4.11, and therefore we have refactored `endChoice` to work more consistent.

#### [1.8.1. Upgrading Camel from version 4.10 to version 4.14 Copy link](#apache-camel-upgrade)

- [Upgrade guide 4.13 → 4.14](https://camel.apache.org/manual/camel-4x-upgrade-guide-4_14.html)
- [Upgrade guide 4.12 → 4.13](https://camel.apache.org/manual/camel-4x-upgrade-guide-4_13.html)
- [Upgrade guide 4.11 → 4.12](https://camel.apache.org/manual/camel-4x-upgrade-guide-4_12.html)
- [Upgrade guide 4.10 → 4.11](https://camel.apache.org/manual/camel-4x-upgrade-guide-4_11.html)