camel-kit-knowledge/indexer/src/main/resources/rh-build-camel/errata/cves/CVE-2022-29599.json

{
  "threat_severity" : "Important",
  "public_date" : "2020-05-29T00:00:00Z",
  "bugzilla" : {
    "description" : "maven-shared-utils: Command injection via Commandline class",
    "id" : "2066479",
    "url" : "https://bugzilla.redhat.com/show_bug.cgi?id=2066479"
  },
  "cvss3" : {
    "cvss3_base_score" : "9.8",
    "cvss3_scoring_vector" : "CVSS:3.1/AV:N/AC:L/PR:N/UI:N/S:U/C:H/I:H/A:H",
    "status" : "verified"
  },
  "cwe" : "CWE-77",
  "details" : [ "In Apache Maven maven-shared-utils prior to version 3.3.3, the Commandline class can emit double-quoted strings without proper escaping, allowing shell injection attacks.", "A flaw was found in the maven-shared-utils package. This issue allows a Command Injection due to improper escaping, allowing a shell injection attack." ],
  "statement" : "Red Hat Satellite ships Candlepin component, which uses the Tomcatjss module from the RHEL AppStream repository. In turn, Tomcatjss relies on Maven, which itself depends on affected Apache Maven Shared Utils. Due to the fact that Satellite does not directly use Apache Maven Shared Utils, or expose it in its code, it is considered not affected by the flaw. Satellite customers can resolve the security warning by updating to the fixed Apache Maven Shared Utils through the updated Maven module, which is available in the RHEL 8 AppStream repository. It's worth noting that this solution applies solely to RHEL 8, which supports modules exclusively, and it is not applicable to earlier versions including RHEL 7.",
  "affected_release" : [ {
    "product_name" : "OCP-Tools-4.12-RHEL-8",
    "release_date" : "2023-06-15T00:00:00Z",
    "advisory" : "RHSA-2023:3610",
    "cpe" : "cpe:/a:redhat:ocp_tools:4.12::el8",
    "package" : "jenkins-2-plugins-0:4.12.1686649756-1.el8"
  }, {
    "product_name" : "OCP-Tools-4.12-RHEL-8",
    "release_date" : "2023-10-30T00:00:00Z",
    "advisory" : "RHSA-2023:6172",
    "cpe" : "cpe:/a:redhat:ocp_tools:4.12::el8",
    "package" : "jenkins-2-plugins-0:4.12.1698294000-1.el8"
  }, {
    "product_name" : "OCP-Tools-4.12-RHEL-8",
    "release_date" : "2024-02-12T00:00:00Z",
    "advisory" : "RHSA-2024:0778",
    "cpe" : "cpe:/a:redhat:ocp_tools:4.12::el8",
    "package" : "jenkins-2-plugins-0:4.12.1706515741-1.el8"
  }, {
    "product_name" : "OCP-Tools-4.13-RHEL-8",
    "release_date" : "2023-06-15T00:00:00Z",
    "advisory" : "RHSA-2023:3622",
    "cpe" : "cpe:/a:redhat:ocp_tools:4.13::el8",
    "package" : "jenkins-2-plugins-0:4.13.1686680473-1.el8"
  }, {
    "product_name" : "OCP-Tools-4.13-RHEL-8",
    "release_date" : "2023-10-30T00:00:00Z",
    "advisory" : "RHSA-2023:6179",
    "cpe" : "cpe:/a:redhat:ocp_tools:4.13::el8",
    "package" : "jenkins-2-plugins-0:4.13.1698292274-1.el8"
  }, {
    "product_name" : "OCP-Tools-4.13-RHEL-8",
    "release_date" : "2024-02-12T00:00:00Z",
    "advisory" : "RHSA-2024:0776",
    "cpe" : "cpe:/a:redhat:ocp_tools:4.13::el8",
    "package" : "jenkins-2-plugins-0:4.13.1706516346-1.el8"
  }, {
    "product_name" : "OCP-Tools-4.14-RHEL-8",
    "release_date" : "2023-11-16T00:00:00Z",
    "advisory" : "RHSA-2023:7288",
    "cpe" : "cpe:/a:redhat:ocp_tools:4.14::el8",
    "package" : "jenkins-2-plugins-0:4.14.1699356715-1.el8"
  }, {
    "product_name" : "OCP-Tools-4.14-RHEL-8",
    "release_date" : "2024-02-12T00:00:00Z",
    "advisory" : "RHSA-2024:0777",
    "cpe" : "cpe:/a:redhat:ocp_tools:4.14::el8",
    "package" : "jenkins-2-plugins-0:4.14.1706516441-1.el8"
  }, {
    "product_name" : "OpenShift Developer Tools and Services for OCP 4.11",
    "release_date" : "2023-05-17T00:00:00Z",
    "advisory" : "RHSA-2023:3198",
    "cpe" : "cpe:/a:redhat:ocp_tools:4.11::el8",
    "package" : "jenkins-2-plugins-0:4.11.1683009941-1.el8"
  }, {
    "product_name" : "OpenShift Developer Tools and Services for OCP 4.11",
    "release_date" : "2023-10-30T00:00:00Z",
    "advisory" : "RHSA-2023:6171",
    "cpe" : "cpe:/a:redhat:ocp_tools:4.11::el8",
    "package" : "jenkins-2-plugins-0:4.11.1698299029-1.el8"
  }, {
    "product_name" : "OpenShift Developer Tools and Services for OCP 4.11",
    "release_date" : "2024-02-12T00:00:00Z",
    "advisory" : "RHSA-2024:0775",
    "cpe" : "cpe:/a:redhat:ocp_tools:4.11::el8",
    "package" : "jenkins-2-plugins-0:4.11.1706516946-1.el8"
  }, {
    "product_name" : "Red Hat Enterprise Linux 7",
    "release_date" : "2022-04-26T00:00:00Z",
    "advisory" : "RHSA-2022:1541",
    "cpe" : "cpe:/o:redhat:enterprise_linux:7",
    "package" : "maven-shared-utils-0:0.4-4.el7_9"
  }, {
    "product_name" : "Red Hat Enterprise Linux 8",
    "release_date" : "2022-05-30T00:00:00Z",
    "advisory" : "RHSA-2022:4797",
    "cpe" : "cpe:/a:redhat:enterprise_linux:8",
    "package" : "maven:3.6-8060020220428115217.32bfc089"
  }, {
    "product_name" : "Red Hat Enterprise Linux 8",
    "release_date" : "2022-05-30T00:00:00Z",
    "advisory" : "RHSA-2022:4798",
    "cpe" : "cpe:/a:redhat:enterprise_linux:8",
    "package" : "maven:3.5-8060020220428102527.219351c9"
  }, {
    "product_name" : "Red Hat Enterprise Linux 8.1 Update Services for SAP Solutions",
    "release_date" : "2022-05-23T00:00:00Z",
    "advisory" : "RHSA-2022:4699",
    "cpe" : "cpe:/a:redhat:rhel_e4s:8.1",
    "package" : "maven:3.5-8010020220428105208.6ece90b1"
  }, {
    "product_name" : "Red Hat Enterprise Linux 8.2 Extended Update Support",
    "release_date" : "2022-05-30T00:00:00Z",
    "advisory" : "RHSA-2022:4797",
    "cpe" : "cpe:/a:redhat:rhel_eus:8.2",
    "package" : "maven:3.6-8020020220428113059.6f73a675"
  }, {
    "product_name" : "Red Hat Enterprise Linux 8.2 Extended Update Support",
    "release_date" : "2022-05-30T00:00:00Z",
    "advisory" : "RHSA-2022:4798",
    "cpe" : "cpe:/a:redhat:rhel_eus:8.2",
    "package" : "maven:3.5-8020020220428105255.1f11a1d9"
  }, {
    "product_name" : "Red Hat Enterprise Linux 8.4 Extended Update Support",
    "release_date" : "2022-05-30T00:00:00Z",
    "advisory" : "RHSA-2022:4797",
    "cpe" : "cpe:/a:redhat:rhel_eus:8.4",
    "package" : "maven:3.6-8040020220428113925.2bbcd66f"
  }, {
    "product_name" : "Red Hat Enterprise Linux 8.4 Extended Update Support",
    "release_date" : "2022-05-30T00:00:00Z",
    "advisory" : "RHSA-2022:4798",
    "cpe" : "cpe:/a:redhat:rhel_eus:8.4",
    "package" : "maven:3.5-8040020220428105311.b9dd3217"
  }, {
    "product_name" : "Red Hat OpenShift Container Platform 4.10",
    "release_date" : "2023-01-04T00:00:00Z",
    "advisory" : "RHSA-2022:9098",
    "cpe" : "cpe:/a:redhat:openshift:4.10::el8",
    "package" : "jenkins-2-plugins-0:4.10.1670851835-1.el8"
  }, {
    "product_name" : "Red Hat OpenShift Container Platform 4.9",
    "release_date" : "2023-02-09T00:00:00Z",
    "advisory" : "RHSA-2023:0573",
    "cpe" : "cpe:/a:redhat:openshift:4.9::el8",
    "package" : "jenkins-2-plugins-0:4.9.1674644684-1.el8"
  }, {
    "product_name" : "Red Hat Software Collections for Red Hat Enterprise Linux 7",
    "release_date" : "2022-05-02T00:00:00Z",
    "advisory" : "RHSA-2022:1662",
    "cpe" : "cpe:/a:redhat:rhel_software_collections:3::el7",
    "package" : "rh-maven36-maven-shared-utils-0:3.2.1-0.2.3.el7"
  } ],
  "package_state" : [ {
    "product_name" : "A-MQ Clients 2",
    "fix_state" : "Not affected",
    "package_name" : "maven-shared-utils",
    "cpe" : "cpe:/a:redhat:a_mq_clients:2"
  }, {
    "product_name" : "Logging Subsystem for Red Hat OpenShift",
    "fix_state" : "Not affected",
    "package_name" : "openshift-logging/elasticsearch6-rhel8",
    "cpe" : "cpe:/a:redhat:logging:5"
  }, {
    "product_name" : "Red Hat AMQ Broker 7",
    "fix_state" : "Not affected",
    "package_name" : "maven-shared-utils",
    "cpe" : "cpe:/a:redhat:amq_broker:7"
  }, {
    "product_name" : "Red Hat A-MQ Online",
    "fix_state" : "Not affected",
    "package_name" : "maven-shared-utils",
    "cpe" : "cpe:/a:redhat:amq_online:1"
  }, {
    "product_name" : "Red Hat build of Apicurio Registry 2",
    "fix_state" : "Not affected",
    "package_name" : "maven-shared-utils",
    "cpe" : "cpe:/a:redhat:service_registry:2"
  }, {
    "product_name" : "Red Hat build of Debezium 1",
    "fix_state" : "Not affected",
    "package_name" : "maven-shared-utils",
    "cpe" : "cpe:/a:redhat:integration:1"
  }, {
    "product_name" : "Red Hat build of Quarkus",
    "fix_state" : "Not affected",
    "package_name" : "maven-shared-utils",
    "cpe" : "cpe:/a:redhat:quarkus:2"
  }, {
    "product_name" : "Red Hat Data Grid 8",
    "fix_state" : "Not affected",
    "package_name" : "maven-shared-utils",
    "cpe" : "cpe:/a:redhat:jboss_data_grid:8"
  }, {
    "product_name" : "Red Hat Decision Manager 7",
    "fix_state" : "Not affected",
    "package_name" : "maven-shared-utils",
    "cpe" : "cpe:/a:redhat:jboss_enterprise_brms_platform:7"
  }, {
    "product_name" : "Red Hat Enterprise Linux 9",
    "fix_state" : "Not affected",
    "package_name" : "maven-shared-utils",
    "cpe" : "cpe:/o:redhat:enterprise_linux:9"
  }, {
    "product_name" : "Red Hat Fuse 7",
    "fix_state" : "Not affected",
    "package_name" : "maven-shared-utils",
    "cpe" : "cpe:/a:redhat:jboss_fuse:7"
  }, {
    "product_name" : "Red Hat Integration Camel K 1",
    "fix_state" : "Not affected",
    "package_name" : "maven-shared-utils",
    "cpe" : "cpe:/a:redhat:integration:1"
  }, {
    "product_name" : "Red Hat Integration Camel Quarkus 1",
    "fix_state" : "Not affected",
    "package_name" : "maven-shared-utils",
    "cpe" : "cpe:/a:redhat:camel_quarkus:2"
  }, {
    "product_name" : "Red Hat Integration Data Virtualisation Operator",
    "fix_state" : "Out of support scope",
    "package_name" : "maven-shared-utils",
    "cpe" : "cpe:/a:redhat:integration:1"
  }, {
    "product_name" : "Red Hat Integration Service Registry",
    "fix_state" : "Out of support scope",
    "package_name" : "maven-shared-utils",
    "cpe" : "cpe:/a:redhat:integration:1"
  }, {
    "product_name" : "Red Hat JBoss Data Grid 7",
    "fix_state" : "Out of support scope",
    "package_name" : "maven-shared-utils",
    "cpe" : "cpe:/a:redhat:jboss_data_grid:7"
  }, {
    "product_name" : "Red Hat JBoss Enterprise Application Platform 6",
    "fix_state" : "Out of support scope",
    "package_name" : "maven-shared-utils",
    "cpe" : "cpe:/a:redhat:jboss_enterprise_application_platform:6"
  }, {
    "product_name" : "Red Hat JBoss Enterprise Application Platform 7",
    "fix_state" : "Not affected",
    "package_name" : "maven-shared-utils",
    "cpe" : "cpe:/a:redhat:jboss_enterprise_application_platform:7"
  }, {
    "product_name" : "Red Hat JBoss Enterprise Application Platform Expansion Pack",
    "fix_state" : "Not affected",
    "package_name" : "maven-shared-utils",
    "cpe" : "cpe:/a:redhat:jbosseapxp"
  }, {
    "product_name" : "Red Hat JBoss Fuse 6",
    "fix_state" : "Out of support scope",
    "package_name" : "maven-shared-utils",
    "cpe" : "cpe:/a:redhat:jboss_fuse:6"
  }, {
    "product_name" : "Red Hat JBoss Fuse Service Works 6",
    "fix_state" : "Out of support scope",
    "package_name" : "maven-shared-utils",
    "cpe" : "cpe:/a:redhat:jboss_fuse_service_works:6"
  }, {
    "product_name" : "Red Hat JBoss Web Server 3",
    "fix_state" : "Out of support scope",
    "package_name" : "maven-shared-utils",
    "cpe" : "cpe:/a:redhat:jboss_enterprise_web_server:3"
  }, {
    "product_name" : "Red Hat JBoss Web Server 5",
    "fix_state" : "Not affected",
    "package_name" : "maven-shared-utils",
    "cpe" : "cpe:/a:redhat:jboss_enterprise_web_server:5"
  }, {
    "product_name" : "Red Hat OpenShift Application Runtimes",
    "fix_state" : "Not affected",
    "package_name" : "maven-shared-utils",
    "cpe" : "cpe:/a:redhat:openshift_application_runtimes:1.0"
  }, {
    "product_name" : "Red Hat Process Automation 7",
    "fix_state" : "Not affected",
    "package_name" : "maven-shared-utils",
    "cpe" : "cpe:/a:redhat:jboss_enterprise_bpms_platform:7"
  }, {
    "product_name" : "Red Hat Single Sign-On 7",
    "fix_state" : "Not affected",
    "package_name" : "maven-shared-utils",
    "cpe" : "cpe:/a:redhat:red_hat_single_sign_on:7"
  }, {
    "product_name" : "Red Hat support for Spring Boot",
    "fix_state" : "Not affected",
    "package_name" : "maven-shared-utils",
    "cpe" : "cpe:/a:redhat:openshift_application_runtimes:1.0"
  }, {
    "product_name" : "streams for Apache Kafka",
    "fix_state" : "Not affected",
    "package_name" : "maven-shared-utils",
    "cpe" : "cpe:/a:redhat:amq_streams:1"
  } ],
  "references" : [ "https://www.cve.org/CVERecord?id=CVE-2022-29599\nhttps://nvd.nist.gov/vuln/detail/CVE-2022-29599" ],
  "name" : "CVE-2022-29599",
  "csaw" : false
}

camel-kit-knowledge/indexer/src/main/resources/rh-build-camel/4.14/release-notes-quarkus.md

#### [1.6.2. Refactored .endChoice() behavior with Java DSL Copy link](#refactored_endchoice_behavior_with_java_dsl)

However, there has been some regressions from upgrading older Camel releases to 4.11, and therefore we have refactored `endChoice` to work more consistent.

#### [1.8.1. Upgrading Camel from version 4.10 to version 4.14 Copy link](#apache-camel-upgrade)

- [Upgrade guide 4.13 → 4.14](https://camel.apache.org/manual/camel-4x-upgrade-guide-4_14.html)
- [Upgrade guide 4.12 → 4.13](https://camel.apache.org/manual/camel-4x-upgrade-guide-4_13.html)
- [Upgrade guide 4.11 → 4.12](https://camel.apache.org/manual/camel-4x-upgrade-guide-4_12.html)
- [Upgrade guide 4.10 → 4.11](https://camel.apache.org/manual/camel-4x-upgrade-guide-4_11.html)